{
  "scenario": "Date functions",
  "description": "The behaviour of built-in formatters is implementation-specific so the `exp` field is often omitted and assertions are made on error cases.",
  "defaultTestProperties": {
    "testType": "function",
    "locale": "en-US",
    "expErrors": false
  },
  "tests": [
    {
      "src": "{:date}",
      "exp": "{:date}",
      "expErrors": [
        {
          "type": "bad-input"
        }
      ]
    },
    {
      "src": "{horse :date}",
      "exp": "{|horse|}",
      "expErrors": [
        {
          "type": "bad-input"
        }
      ]
    },
    {
      "src": "{|2006-01-02| :date}"
    },
    {
      "src": "{|2006-01-02T15:04:06| :date}"
    },
    {
      "src": "{|2006-01-02| :date style=long}"
    },
    {
      "src": ".local $d = {|2006-01-02| :date style=long} {{{$d :date}}}"
    },
    {
      "src": ".local $t = {|2006-01-02T15:04:06| :time} {{{$t :date}}}"
    }
  ]
}
